{
  "format": "go-go-harmoniyo.chart",
  "formatVersion": "0.2.0",
  "generator": {"name":"go-go-harmoniyo/spikes/s5-chart-pipeline","version":"0.2.0"},
  "song": {
    "id": "the-holly-and-the-ivy",
    "title": "The Holly and the Ivy",
    "composer": "Traditional English",
    "year": null,
    "key": "F",
    "license": {"id":"CC0-1.0","url":"https://creativecommons.org/publicdomain/zero/1.0/"},
    "source": {"kind":"self-encoded","notes":"Traditional English melody (public domain), checked note by note against the Mutopia edition kept in sources/mutopia/thehollyandtheivy.* (a test compares them). SATB: the alto, tenor and bass parts and the chord symbols are our own hymn-style harmony. Written by the S5 agent (GitHub Copilot, Claude Opus 5.5), 2026-10-25. AI-generated (CC0); owner resemblance review pending.","file":"spikes/s5-chart-pipeline/songs/the-holly-and-the-ivy.abc"}
  },
  "timing": {
    "resolution": 480,
    "tempos": [
      {"tick":0,"time":0,"bpm":100}
    ],
    "timeSignatures": [
      {"tick":0,"numerator":3,"denominator":4}
    ],
    "measures": [
      {"number":1,"tick":0,"time":0,"pickup":true},
      {"number":2,"tick":480,"time":0.6,"pickup":false},
      {"number":3,"tick":1920,"time":2.4,"pickup":false},
      {"number":4,"tick":3360,"time":4.2,"pickup":false},
      {"number":5,"tick":4800,"time":6,"pickup":false},
      {"number":6,"tick":6240,"time":7.8,"pickup":false},
      {"number":7,"tick":7680,"time":9.6,"pickup":false},
      {"number":8,"tick":9120,"time":11.4,"pickup":false},
      {"number":9,"tick":10560,"time":13.2,"pickup":false},
      {"number":10,"tick":12000,"time":15,"pickup":false},
      {"number":11,"tick":13440,"time":16.8,"pickup":false},
      {"number":12,"tick":14880,"time":18.6,"pickup":false},
      {"number":13,"tick":16320,"time":20.4,"pickup":false},
      {"number":14,"tick":17760,"time":22.2,"pickup":false},
      {"number":15,"tick":19200,"time":24,"pickup":false},
      {"number":16,"tick":20640,"time":25.8,"pickup":false},
      {"number":17,"tick":22080,"time":27.6,"pickup":false}
    ],
    "endTick": 23040,
    "durationSec": 28.8
  },
  "bells": [
    {"id":"A#2","midi":46,"natural":false},
    {"id":"C3","midi":48,"natural":true},
    {"id":"D3","midi":50,"natural":true},
    {"id":"E3","midi":52,"natural":true},
    {"id":"F3","midi":53,"natural":true},
    {"id":"G3","midi":55,"natural":true},
    {"id":"A3","midi":57,"natural":true},
    {"id":"A#3","midi":58,"natural":false},
    {"id":"C4","midi":60,"natural":true},
    {"id":"D4","midi":62,"natural":true},
    {"id":"E4","midi":64,"natural":true},
    {"id":"F4","midi":65,"natural":true},
    {"id":"G4","midi":67,"natural":true},
    {"id":"A4","midi":69,"natural":true},
    {"id":"A#4","midi":70,"natural":false},
    {"id":"C5","midi":72,"natural":true},
    {"id":"D5","midi":74,"natural":true}
  ],
  "handbellSet": {"set":"3oct","label":"3 octaves C4–C7 (37 bells)","transposeSemitones":14,"span":28},
  "harmony": {
    "source": "lead-sheet",
    "style": "waltz",
    "chords": [
      {"tick":0,"time":0,"dur":480,"durSec":0.6,"symbol":"F","root":5,"bass":5,"tones":[5,9,0]},
      {"tick":480,"time":0.6,"dur":960,"durSec":1.2,"symbol":"F","root":5,"bass":5,"tones":[5,9,0]},
      {"tick":1440,"time":1.8,"dur":480,"durSec":0.6,"symbol":"Bb","root":10,"bass":10,"tones":[10,2,5]},
      {"tick":1920,"time":2.4,"dur":480,"durSec":0.6,"symbol":"C","root":0,"bass":0,"tones":[0,4,7]},
      {"tick":2400,"time":3,"dur":960,"durSec":1.2,"symbol":"F","root":5,"bass":5,"tones":[5,9,0]},
      {"tick":3360,"time":4.2,"dur":480,"durSec":0.6,"symbol":"F","root":5,"bass":5,"tones":[5,9,0]},
      {"tick":3840,"time":4.8,"dur":480,"durSec":0.6,"symbol":"Dm","root":2,"bass":2,"tones":[2,5,9]},
      {"tick":4320,"time":5.4,"dur":480,"durSec":0.6,"symbol":"Bb","root":10,"bass":10,"tones":[10,2,5]},
      {"tick":4800,"time":6,"dur":960,"durSec":1.2,"symbol":"C","root":0,"bass":0,"tones":[0,4,7]},
      {"tick":5760,"time":7.2,"dur":480,"durSec":0.6,"symbol":"C7","root":0,"bass":0,"tones":[0,4,7,10]},
      {"tick":6240,"time":7.8,"dur":480,"durSec":0.6,"symbol":"F","root":5,"bass":5,"tones":[5,9,0]},
      {"tick":6720,"time":8.4,"dur":480,"durSec":0.6,"symbol":"Bb/D","root":10,"bass":2,"tones":[10,2,5]},
      {"tick":7200,"time":9,"dur":480,"durSec":0.6,"symbol":"F","root":5,"bass":5,"tones":[5,9,0]},
      {"tick":7680,"time":9.6,"dur":480,"durSec":0.6,"symbol":"Bb","root":10,"bass":10,"tones":[10,2,5]},
      {"tick":8160,"time":10.2,"dur":480,"durSec":0.6,"symbol":"C","root":0,"bass":0,"tones":[0,4,7]},
      {"tick":8640,"time":10.8,"dur":480,"durSec":0.6,"symbol":"Dm","root":2,"bass":2,"tones":[2,5,9]},
      {"tick":9120,"time":11.4,"dur":960,"durSec":1.2,"symbol":"F/C","root":5,"bass":0,"tones":[5,9,0]},
      {"tick":10080,"time":12.6,"dur":480,"durSec":0.6,"symbol":"C7","root":0,"bass":0,"tones":[0,4,7,10]},
      {"tick":10560,"time":13.2,"dur":1440,"durSec":1.8,"symbol":"F","root":5,"bass":5,"tones":[5,9,0]},
      {"tick":12000,"time":15,"dur":960,"durSec":1.2,"symbol":"F","root":5,"bass":5,"tones":[5,9,0]},
      {"tick":12960,"time":16.2,"dur":480,"durSec":0.6,"symbol":"Bb","root":10,"bass":10,"tones":[10,2,5]},
      {"tick":13440,"time":16.8,"dur":480,"durSec":0.6,"symbol":"C","root":0,"bass":0,"tones":[0,4,7]},
      {"tick":13920,"time":17.4,"dur":960,"durSec":1.2,"symbol":"F","root":5,"bass":5,"tones":[5,9,0]},
      {"tick":14880,"time":18.6,"dur":480,"durSec":0.6,"symbol":"F","root":5,"bass":5,"tones":[5,9,0]},
      {"tick":15360,"time":19.2,"dur":480,"durSec":0.6,"symbol":"Dm","root":2,"bass":2,"tones":[2,5,9]},
      {"tick":15840,"time":19.8,"dur":480,"durSec":0.6,"symbol":"Bb","root":10,"bass":10,"tones":[10,2,5]},
      {"tick":16320,"time":20.4,"dur":960,"durSec":1.2,"symbol":"C","root":0,"bass":0,"tones":[0,4,7]},
      {"tick":17280,"time":21.6,"dur":480,"durSec":0.6,"symbol":"C7","root":0,"bass":0,"tones":[0,4,7,10]},
      {"tick":17760,"time":22.2,"dur":480,"durSec":0.6,"symbol":"F","root":5,"bass":5,"tones":[5,9,0]},
      {"tick":18240,"time":22.8,"dur":480,"durSec":0.6,"symbol":"Bb/D","root":10,"bass":2,"tones":[10,2,5]},
      {"tick":18720,"time":23.4,"dur":480,"durSec":0.6,"symbol":"Dm","root":2,"bass":2,"tones":[2,5,9]},
      {"tick":19200,"time":24,"dur":480,"durSec":0.6,"symbol":"Bb","root":10,"bass":10,"tones":[10,2,5]},
      {"tick":19680,"time":24.6,"dur":480,"durSec":0.6,"symbol":"C","root":0,"bass":0,"tones":[0,4,7]},
      {"tick":20160,"time":25.2,"dur":480,"durSec":0.6,"symbol":"Dm","root":2,"bass":2,"tones":[2,5,9]},
      {"tick":20640,"time":25.8,"dur":960,"durSec":1.2,"symbol":"F/C","root":5,"bass":0,"tones":[5,9,0]},
      {"tick":21600,"time":27,"dur":480,"durSec":0.6,"symbol":"C7","root":0,"bass":0,"tones":[0,4,7,10]},
      {"tick":22080,"time":27.6,"dur":960,"durSec":1.2,"symbol":"F","root":5,"bass":5,"tones":[5,9,0]}
    ],
    "beats": [
      {"tick":0,"time":0,"bar":1,"beat":2,"div":2,"strong":false,"chord":0},
      {"tick":480,"time":0.6,"bar":2,"beat":0,"div":2,"strong":true,"chord":1},
      {"tick":960,"time":1.2,"bar":2,"beat":1,"div":2,"strong":false,"chord":1},
      {"tick":1440,"time":1.8,"bar":2,"beat":2,"div":2,"strong":false,"chord":2},
      {"tick":1920,"time":2.4,"bar":3,"beat":0,"div":2,"strong":true,"chord":3},
      {"tick":2400,"time":3,"bar":3,"beat":1,"div":2,"strong":false,"chord":4},
      {"tick":2880,"time":3.6,"bar":3,"beat":2,"div":2,"strong":false,"chord":4},
      {"tick":3360,"time":4.2,"bar":4,"beat":0,"div":2,"strong":true,"chord":5},
      {"tick":3840,"time":4.8,"bar":4,"beat":1,"div":2,"strong":false,"chord":6},
      {"tick":4320,"time":5.4,"bar":4,"beat":2,"div":2,"strong":false,"chord":7},
      {"tick":4800,"time":6,"bar":5,"beat":0,"div":2,"strong":true,"chord":8},
      {"tick":5280,"time":6.6,"bar":5,"beat":1,"div":2,"strong":false,"chord":8},
      {"tick":5760,"time":7.2,"bar":5,"beat":2,"div":2,"strong":false,"chord":9},
      {"tick":6240,"time":7.8,"bar":6,"beat":0,"div":2,"strong":true,"chord":10},
      {"tick":6720,"time":8.4,"bar":6,"beat":1,"div":2,"strong":false,"chord":11},
      {"tick":7200,"time":9,"bar":6,"beat":2,"div":2,"strong":false,"chord":12},
      {"tick":7680,"time":9.6,"bar":7,"beat":0,"div":2,"strong":true,"chord":13},
      {"tick":8160,"time":10.2,"bar":7,"beat":1,"div":2,"strong":false,"chord":14},
      {"tick":8640,"time":10.8,"bar":7,"beat":2,"div":2,"strong":false,"chord":15},
      {"tick":9120,"time":11.4,"bar":8,"beat":0,"div":2,"strong":true,"chord":16},
      {"tick":9600,"time":12,"bar":8,"beat":1,"div":2,"strong":false,"chord":16},
      {"tick":10080,"time":12.6,"bar":8,"beat":2,"div":2,"strong":false,"chord":17},
      {"tick":10560,"time":13.2,"bar":9,"beat":0,"div":2,"strong":true,"chord":18},
      {"tick":11040,"time":13.8,"bar":9,"beat":1,"div":2,"strong":false,"chord":18},
      {"tick":11520,"time":14.4,"bar":9,"beat":2,"div":2,"strong":false,"chord":18},
      {"tick":12000,"time":15,"bar":10,"beat":0,"div":2,"strong":true,"chord":19},
      {"tick":12480,"time":15.6,"bar":10,"beat":1,"div":2,"strong":false,"chord":19},
      {"tick":12960,"time":16.2,"bar":10,"beat":2,"div":2,"strong":false,"chord":20},
      {"tick":13440,"time":16.8,"bar":11,"beat":0,"div":2,"strong":true,"chord":21},
      {"tick":13920,"time":17.4,"bar":11,"beat":1,"div":2,"strong":false,"chord":22},
      {"tick":14400,"time":18,"bar":11,"beat":2,"div":2,"strong":false,"chord":22},
      {"tick":14880,"time":18.6,"bar":12,"beat":0,"div":2,"strong":true,"chord":23},
      {"tick":15360,"time":19.2,"bar":12,"beat":1,"div":2,"strong":false,"chord":24},
      {"tick":15840,"time":19.8,"bar":12,"beat":2,"div":2,"strong":false,"chord":25},
      {"tick":16320,"time":20.4,"bar":13,"beat":0,"div":2,"strong":true,"chord":26},
      {"tick":16800,"time":21,"bar":13,"beat":1,"div":2,"strong":false,"chord":26},